index,tweet,sarcastic,rephrase,sarcasm,irony,satire,understatement,overstatement,rhetorical_question
469,Hands up who remembers when EVERY blogger and their dog was a brand ambassador for Coconut Lane 😂,1,Who remembers when some bloggers were brand ambassadors for Coconut Lane? - i.e. without any emojis.,1.0,0.0,0.0,0.0,1.0,0.0
675,I’ve been laid off !! Nice:)),1,"""I can't believe I've been laid off. Super upset and nervous.""",1.0,0.0,0.0,0.0,0.0,0.0
271,Didn't you have all the beverages at Acapulco's last night? ,0,@xNemoooo @McDonaldsUK @tasshx Say swear you didn’t down all bev’s at Acapulco’s straight after?? 😘,1.0,0.0,0.0,0.0,0.0,0.0
17,I hope whoever keeps peeing all over the bathroom at work stops doing that.,0,"Whoever’s toddler ass sprayed the entire toilet backstage, I hope you stub your toe and bite your tongue really hard. also you were clearly dehydrated, go drink some damn water like an adult",1.0,0.0,0.0,0.0,0.0,0.0
590,Yes,0,my computer does this fun thing now where it shakes in a way that exactly replicates what happens to my vision when i forget my meds so that’s exciting !,0.0,1.0,0.0,0.0,0.0,0.0
805,Love seeing 15 year olds being vaccinated in the states when I have to wait till the end of June for my first one,1,I don't like the fact that younger people in america are getting the vaccine when I still have to wait another month for mine in england ,1.0,0.0,0.0,0.0,0.0,0.0
778,"Don’t keep up with the Joneses, the Joneses are broke!",1,Don’t keep up with the Jones’s ,1.0,0.0,0.0,0.0,1.0,0.0
242,I think we've all heard enough about Harry and Meghan's engagement.,0,Does anyone not know Prince Harry got engaged? I don’t think there’s been enough in the news about it.,1.0,0.0,0.0,0.0,0.0,1.0
806,“You’re not “just friends” if you’re shaving your coochie every time you know you’ll see them.” ,0,"oh you’re just friends?

why’d u shave then?",1.0,0.0,0.0,0.0,0.0,1.0
143,There is a website you could use to check if the airbnb is available ,0,I’ve seen a lot of people on local Facebook groups asking AirBnB owners if they have any availability recently. If only there was a website you could use to find out if an AirBnB was available 🤔,1.0,0.0,0.0,0.0,0.0,0.0
788,Understand the meaning of being a true friend. ,0,"""friends""",1.0,0.0,0.0,0.0,0.0,0.0
122,So in other news I just held the door open for Bam Adebayo &amp; then I fell down the stairs &amp; I think I broke my finger.. ya I'm THAT smooth,1,I just fell down the stairs after holding the door open for Bam Adebayo. I really embarrassed myself.,1.0,0.0,0.0,0.0,0.0,0.0
650,shoutout to the kid who brought a pineapple to hc and threw it around #madrespect,1,"""Screw the kid who brought a pineapple to homecoming and threw it around""",1.0,0.0,0.0,0.0,0.0,0.0
668,"""Football acts in such a strange way, with players asking for huge increases while already under a long contract""",0,@TheSpursExpress @JBurtTelegraph I've done this to my employer too. I'm expecting we'll both get the same answer,1.0,0.0,0.0,0.0,0.0,0.0
614,I’m gonna miss scantrons shortening my name to “Christ” after 16 years,1,I'm not going to miss scantrons shortening my name to “Christ” after 16 years,0.0,1.0,0.0,0.0,0.0,0.0
322,just stuck my entire hand in a hot oven without thinking about the consequences. self preservation is clearly my strong suit,1,Self preservation isnt my strong suit,1.0,0.0,0.0,0.0,0.0,0.0
613,Matt Hancock is a top shagger,1,Matt Hancock is a wanker,1.0,0.0,0.0,0.0,1.0,0.0
617,"""Just watched a man smoke crack on the R train in front of 3 families. New York is continuing to become less safe.""",0,Just watched a man smoke crack on the R train in front of 3 families. New York is healing ✨,1.0,0.0,0.0,0.0,0.0,0.0
157,It’s really very selfish of Silverstone to be saying the 2022 Grand Prix is 1/7-3/7 cause my holiday year starts on 1/7 and I would have to use a day of this years holiday allowance to go. I should have been consulted really 😵‍💫😵‍💫😵‍💫,1,It’s  really annoying I have to use one day of my holiday allowance this year to attend the Grand Prix. ,1.0,0.0,0.0,0.0,0.0,0.0
537,“I am embarrassed because of what I said in class on Zoom”,0,you ever completely embarrass yourself on zoom and decide to drop out of college?,1.0,0.0,0.0,0.0,0.0,1.0
466,The Yankees are a really bad team right now and it's amazing how fast they can fall.,0,Amazing how fast this team can go winning from 13 straight to losing three in a row. Lol. Horrible managing tonight. I really hope this Boone experiment is over soon.,1.0,0.0,0.0,0.0,0.0,0.0
91,An uninteresting conversation regarding the importance of an Orlando Magic Summer League title. ,0,Raging debate on the importance of an Orlando Magic Summer League Championship. Definitely a notch below 6 if decided by coin flip. https://t.co/LG0VRwkrKO,0.0,1.0,0.0,0.0,0.0,0.0
662,Man PepsiCo loves to add 750g of sugar to a mixture of their existing flavors of sodas and call it a new flavor of dew or Pepsi...,1,"The flavors aren't good, they all just taste like sugar and artificial flavoring",1.0,0.0,0.0,0.0,1.0,0.0
837,@majornelson Sounds like a strong contender for GOTY,1,"This game is terrible, it will definitely not win a GOTY award. ",0.0,1.0,0.0,0.0,0.0,0.0
698,"@Rosievix @mouthwaite Well, illegal immigrants  categorically don’t get money from the government but why let a little thing like facts get in the way of a good bit of xenophobia...",1,"I'd end the sentence by saying ""but your xenophobia means that you have ignored the facts"".",0.0,1.0,0.0,0.0,0.0,0.0
524,Should I wear my red and blue pants ,0,"""Should I wear my lime green pants?"" dad its 4th of july...",1.0,0.0,0.0,0.0,0.0,1.0
532,My favorite part about running on the track is seeing how high my heart rate gets just walking up the stairs to it.,1,My heart rate spiked when I walk up the stairs to the track,1.0,0.0,0.0,0.0,0.0,0.0
264,I like online shopping because I am shy.,0,I love online shopping because if I am physically in a store and an employee even looks at me I will immediately leave.,1.0,0.0,0.0,0.0,0.0,0.0
694,Day 1 in our new dystopian society is not going well,0,"I'm literally out here trading eggs for potatoes

Day 1 in our new dystopian society is going well #coronavirusUK #coronavirus",0.0,1.0,0.0,0.0,0.0,0.0
94,I hate feeling burnt out from work and the never-ending pandemic.,0,Ah gotta love that Friday morning burnt out feeling 🌄,0.0,1.0,0.0,0.0,0.0,0.0
523,@GainzyXBT Actually I've extrapolated based on the last daily candle and it turns out BTC will be sub-zero by December. The math doesn't lie.,1,I'm not entirely sure you -can- say the same thing non-sarcastically. I suppose... 'Constantly calling for lower targets is ridiculous.',1.0,0.0,0.0,0.0,0.0,0.0
759,"Young people are in need of the stimulus too. Just because we do not have kids does not mean that we do not have bills, debt, etc.",0,"Stimulus checks should come with hand lotion, a face mask, and a bonus for every Instagram bingos you do",0.0,1.0,0.0,0.0,0.0,0.0
708,Would it be wrong to spend £50 on a bonsai plant?,0,Is it unreasonable to spend £50 on a bonsai tree? Asking for a friend 🤔,1.0,0.0,0.0,0.0,0.0,0.0
47,I don’t think he drank 11 beers every hour,0,"@AlexShawESPN @robwishart @GNev2 Does he order 11 at once and drink each one at just over 5 minutes, OR do we have to take into account going to the bar? Either way it’s a disgrace and not what we should be promoting to the kids.",1.0,0.0,0.0,0.0,0.0,1.0
645,The side effects of antidepressants can be concerning.,0,Why are the side effects of antidepressants so ✨scary✨,0.0,1.0,0.0,0.0,1.0,0.0
686,"apparently it's the biggest ask on the planet to find decently priced sandals with an enclosed toe. PLEASE, INTERNET. I just want to have vaguely summery shoes that don't involve me having my toes out to the world at all times lmfaoo",1,I'm finding it hard to buy affordable enclosed toe sandals on the internet.,0.0,1.0,0.0,0.0,1.0,0.0
768,being single during college must be really fun when ur nOT IN A GLOBAL PANDEMIC,1,"being single in college, especially during a global pandemic, is boring and disheartening",1.0,0.0,0.0,0.0,0.0,0.0
429,I am pleased with my team’s performance,0,"Thanks to India for being so inept. I was hoping for a full day of cricket, got snacks and everything. Cheers. You could have at least tried. #bbccricket #INDvENG #ENGvsIND #Cricket",1.0,0.0,0.0,0.0,0.0,0.0
202,I'm interested that you have a book out.,0,"@richardosman @GMB @susannareid100 @piersmorgan You've a book out? I hadn't realised.

Yes, you've already read this 8763 times this week, but hey.",1.0,0.0,0.0,0.0,0.0,1.0
822,@DetroitPistons @PistonsGT Cade Cunningham is my favorite basketball player please 2K 🙏🙏🙏,1,"""I'm not a Piston's fan but it would be really fun to play with them in 2K22.""",1.0,0.0,1.0,0.0,0.0,0.0
269,Shout out James Boswell  #unibowl,1,James Boswell is a waste man.,1.0,0.0,0.0,0.0,0.0,0.0
390,"ALERT, spider-man is on the uta campus.",0,not to alarm anyone but i just saw spider-man by uta,1.0,0.0,0.0,0.0,0.0,0.0
855,It is extremely hard to quit meth as it is a disease rather than an addiction. ,0,"will never understand why ppl do meth,, just buy a shit tonne of incense in bulk stupid",1.0,0.0,0.0,0.0,0.0,0.0
752,"I would take out “when,” and insert more displeased looking emojis at the end or maybe have none at all",0,When you order books from the bookstore a week in advance and then you wait three weeks for ONE book and when you finally email them about it they reply and say they cancelled your order 😍🥰,1.0,0.0,0.0,0.0,0.0,0.0
632,good evening sharks. hooters but for feet.,1,A hooters for feet is an absurd business model.,0.0,1.0,0.0,0.0,0.0,0.0
24,"@AsdaServiceTeam imagine your delivery being 2 hours late, and imagine calling up your service team only for them to hang up at 10pm, coincidentally the same time the office closes. But it’s okay, my £3 delivery fee is being refunded though 👊🏻",1,It's not acceptable for you to just refund my delivery fee. ,1.0,0.0,0.0,0.0,0.0,0.0
566,Wow great album from Kanye. v John Cage 4’43 vibes x,1,Kanye needs to actually release his album. ,1.0,0.0,1.0,0.0,0.0,0.0
407,@TheLunaCinema @seetickets absolutely no response from Luna Cinema and my completely factual review on See Tickets has been moderated and will not be published 🤔 great to see @seetickets looking out for their customers. Excellent customer service all round 👏,1,The customer service I have received has been terrible ,1.0,0.0,0.0,0.0,0.0,0.0
108,"""He's not welcome in a tolerant place like London"" @emmadentcoad  on the Presidential visit on @BBCRadio4 The irony in that comment... #r4bh",1,Donald Trump is not welcome in a place like London.,1.0,0.0,0.0,0.0,0.0,0.0
184,Me and Noah forgot our anniversary. That is not “couple goals” ,0,me and noah forgot that today is our anniversary. if that isn’t couple goals then idk what is 😌,1.0,0.0,0.0,0.0,0.0,0.0
153,"EFY is a time for white, religious kids to make weird friends and mess around while not doing anything productive.",0,Efy is great,0.0,1.0,0.0,0.0,0.0,0.0
373,"Our field shouldn't try to force human experience into quantifiable models, but it pretty consistently does.",0,@avsmph But how can we possibly deal with a human experience we haven't first relentlessly quantified???,1.0,0.0,0.0,0.0,0.0,1.0
597,"North Dakota: *has one decent week of weather*
Mother Nature: NOW I SHALL CAST OUT THE SUN AND BRING THE COLDEST OF RAINS UPON THY SUPER, DUPER FLAT LAND.",1,North Dakota had a nice week of weather followed by a rainy day.,0.0,1.0,0.0,0.0,1.0,0.0
790,breaking my strict buying hiatus to get lisa’s album? it’s much more likely than you’d think,1,I will break my buying hiatus to buy this album,1.0,0.0,0.0,1.0,0.0,1.0
622,The Red Sox probably wish they could play the Orioles all season. ,0,If I were the Red Sox I would simply play the Orioles more,1.0,0.0,0.0,0.0,0.0,0.0
529,People with curly hair are attractive. ,0,do i like him or is his hair just curly??,1.0,0.0,0.0,0.0,0.0,0.0
736,I would not take ivermectin. ,0,Might just fuck around and take some horse dewormer for the thrill of if. Maybe I’ll feel something,1.0,0.0,0.0,0.0,0.0,0.0
178,A wrong impression is once again my specialty,1,Unfortunately I made the wrong impressions again. ,1.0,0.0,0.0,0.0,0.0,0.0
116,"Don't say ""dems in disarray,"" because they aren't.",0,"make it illegal to say/write ""Dems in disarray"" on account of it being stupid as fuck",1.0,0.0,0.0,0.0,0.0,0.0
71,"The hallways are very crowded lately. I would prefer to take another form of transportation that is more efficient than walking, but none such option exists.",0,considering crowd surfing the next time the hallways are too packed,0.0,1.0,0.0,0.0,0.0,0.0
671,Bristol is absolutely littered with students!! Glad I never was one🙈,1,I was one of them once,1.0,0.0,0.0,0.0,0.0,0.0
723,"Watched 127 hours... Kinda reminded me of this one time I got a bad splinter. Writing a book about it now, hit me up for an autographed copy",1,I could never survive an experience like the one in the film 127 Hours.,1.0,0.0,0.0,0.0,0.0,0.0
670,"@AmazonUK why does Alexa UK not get improvements like Guard, Adaptive Volume, Male voice? Should we pay less for the devices than the US equivalent?",1,I wouldn't put it in a question and instead would state we should not pay the same as another country if the service is subpar.,1.0,0.0,0.0,0.0,0.0,1.0
123,I can't believe today is the last day we can be gay.,1,Today is the last day of pride month.,1.0,0.0,0.0,0.0,0.0,0.0
372,yes,0,"Synthwave communities really love pessimism don't they haha
Any upbeat energy and people get upset at ya",1.0,0.0,0.0,0.0,0.0,1.0
721,it's all about women in stem struggles. what about women in interactive media struggles: i no longer win against my friends in smash because they major in goddamn video game.,1,"Probably would not say it at all because the statement itself is kind of ridiculous. ""Because I'm in a media major, all of my friends are better at video games than me.""",0.0,1.0,0.0,0.0,0.0,0.0
441,"I would say ""I have zero interest in sports, so definitely regretting the decision to sign up for a sports business class that's making me tweet about sports every day...""",0,"For a good laugh, follow me over on @vsheltonsports to see my best attempt at covering sports business news for class this semester.",1.0,0.0,1.0,0.0,0.0,0.0
767,"Ah yes, back spasms when I take a deep breath. This is ✨28✨.",1,I should not be having back spasms when I take deep breaths at age 28.,0.0,1.0,0.0,0.0,0.0,0.0
490,what a great day to be stuck inside 🙃,1,It's a terrible day to be stuck inside.,1.0,0.0,0.0,0.0,0.0,0.0
134,Javid hasn't actually opened any new hospitals - he's just announcing that he has when actually he's opening a new facility within an existing hospital,0,"@mjborshell @garygilligan Hasn't he opened a few new hospitals? Oh sorry, maybe it was a new first aid box.",1.0,0.0,0.0,0.0,0.0,0.0
221,Some jerk just honked at a garbage truck because it had to slow down to turn. It was obnoxious,0,"Cool guy in a big truck honked really long at the garbage truck because it slowed down to turn; I felt he wanted everyone to know how cool he is, so I decided to tweet about it on his behalf.",1.0,0.0,0.0,0.0,0.0,0.0
34,"""Not happy i have been compared to a brick wall"".",0,Nice to be compared to a brick wall 😂,1.0,0.0,0.0,0.0,0.0,0.0
124,You don’t need to post a picture from airplane window every time you fly since all pictures from the window are practically the same. ,0,did you actually fly on a plane if you didn’t post a picture of the view from your window?,1.0,0.0,0.0,0.0,0.0,1.0
491,Happy birthday to me!! I’m 30! 😭,1,I'm 30! Id like to wish myself a happy birthday,1.0,0.0,0.0,0.0,0.0,0.0
834,The high tomorrow is 45! Anyone wanna go to the pool?,1,It is finally going to reach 45 degrees outside.,0.0,1.0,0.0,0.0,0.0,1.0
560,Having morning sickness when you're not actually pregnant is all the fun,1,Having morning sickness when you're not actually sick is not fun!,0.0,1.0,0.0,0.0,0.0,0.0
820,It’s so easy to have the best day until someone lies to your face 🥰❤️😭,1,I hate when people lie to my face. It ruins my day when people lie to my face.,1.0,0.0,0.0,0.0,0.0,0.0
507,Getting a dog was the best thing I could’ve ever done. ,0,Getting a dog was single handedly the best and worst thing I’ve ever done..can’t imagine life without her and I can’t live without her.. Make sense?,1.0,0.0,0.0,0.0,0.0,0.0
234,"Well done Henri, cost us the win #nffc",1,"Terrible Henri,  you cost us the win.",1.0,0.0,0.0,0.0,0.0,0.0
543,bad romance by lady gaga is the best song to ever come out of the american music industry and anyone who says otherwise is a liar,1,Bad Romance is a bad song,1.0,0.0,0.0,0.0,0.0,0.0
410,Yes you can break all the rules for Christmas and risk serious fines and killing your loved ones with a deadly virus OR you could ✨stay at home✨,1,Please do not break the rules for christmas and risk serious fines or killing loved ones. Please stay home.,1.0,0.0,0.0,0.0,0.0,0.0
591,I am living on salad and yogurt and it's getting old ,0,I'm just living off salads and yogurt and loving it tbh,0.0,1.0,0.0,0.0,0.0,0.0
321,im about to just walk into a place and start working then and there and they'll have no choice but to hire me on the spot,1,I wish someone would hire me so I don't have to go through hoops and hurdles.,1.0,0.0,0.0,0.0,0.0,0.0
354,"Fleury’s going to make a mistake every once in awhile, he’s only human.",0,The fair-weather fans in all of these threads. Wake up call. Fleury is a human being. Surprise!,1.0,0.0,0.0,0.0,0.0,0.0
43,"I suppose though, we did sign one for the future so, you know, not all gloom and doom...we might be good in 6 years time.",1,I wish we could have signed a player for the first team. ,1.0,0.0,0.0,1.0,0.0,0.0
504,"New levels of desperation: my lack of sleep is not a joke, in fact it’s a downright annoyance ",0,"New levels of desperation: sleep is now truly insignificant to me. In fact, it’s a downright annoyance.",1.0,0.0,0.0,0.0,0.0,0.0
849,everyone say a prayer to the insurance gods that they approve my heart monitor so that i may continue to have the privilege of being alive. i love the US health care system,1,I hate the US health care system.,1.0,0.0,0.0,0.0,0.0,0.0
240,"“If I could have changed anything about my childhood I would have never watched spongebob”

-no one",1,"""I don't think anyone regrets watching Spongebob as a child""",0.0,1.0,0.0,0.0,0.0,0.0
639,The lyrics in Taylor Swift's album remind me of the characters from (insert tv show here)!,0,omg my ships are gonna love what taylor swift has done for them,1.0,0.0,0.0,0.0,0.0,0.0
476,"Oh boy, a song I'm gonna play on repeat until it makes me physically ill to hear it! Thanks FOB",1,"""I can't stop listening to this new song from FOB""",1.0,0.0,0.0,0.0,0.0,0.0
553,Use the hashtag #wastedtime instead,0,It really bugs me when teachers uncap and recap highlighters three or four times per book when marking - Poor time management! #efficiency,1.0,0.0,0.0,0.0,0.0,0.0
21,Lynx Africa is terrible and I’m glad I didn’t get one for Christmas this year ,0,"Not got one lynx Africa for Christmas Day this year, shocked and outraged. #RuinedChristmas",0.0,1.0,0.0,0.0,0.0,0.0
341,"I could've replied ""You do not despise me, you're my best friend.""",0,@Dancruz07 Sureeeeeee you do,1.0,0.0,0.0,0.0,0.0,0.0
166,"me: trying to sleep slightly earlier than usual bc I feel like shit 
my friend, texting the group chat 13 separate times at nearly 4am: hello I don’t think so! how abt I tell u abt how bad things are going instead :)",1,"I might say “I am so annoyed that my roommate won’t stop venting to me when I’m trying to sleep, I already don’t feel good and was trying to sleep Early for Self Care and having them bombard me with their problems at 4am is really putting a damper on things”",1.0,0.0,0.0,0.0,0.0,0.0
615,I’m bored in lockdown which has now resulted in me buying jigsaws like an old woman ,0,"Day 55 of Lockdown. Finally bought some jigsaw puzzles. Absolutely cannot wait for them to come, highlight of my day (maybe even year)",0.0,1.0,0.0,0.0,0.0,0.0
498,this is the worst background noise to study with.,0,"If the sound of the rain outside wasn’t bad enough I’ve now got my neighbours climbing onto their roof and shouting ‘I love blowjobs’, perfect background noise for me trying to study 👍🏻",1.0,0.0,0.0,0.0,0.0,0.0
585,Sometimes I wonder if Priti Patel and Boris Johnson think that the Prime Minister is the one with the best K/D ratio. It would make sense with the whole 'let the bodies pile high' thing.,1,Priti Patel and Boris Johnson are doing a terrible job dealing with Covid.,1.0,0.0,0.0,0.0,0.0,0.0
320,Having a bad week but what else is new!! At least I finally got paid 💕😭,1,I had another bad day which is becoming common for me at the moment.,1.0,0.0,0.0,0.0,0.0,1.0
103,Fool me once shame on you. Fool me twice shame on me. Fool me multiple times I must have become a brexiter. #Brexit,1,by simply stating the foolishness of voting in favour of brexit ,1.0,0.0,0.0,0.0,0.0,0.0
102,Do the #Hokies really have to play 5 against 6 tonight? Come on stripes,1,Why is the ref helping the other team?,1.0,0.0,0.0,0.0,0.0,0.0
503,if jesus was resurrected again i would vote for him,1,Our candidates for president are so bad.,1.0,0.0,0.0,0.0,0.0,0.0
638,I won't be eating at the Eastpointe Chick-Fil-A this summer.,0,I would like to dedicate my hot girl summer to the Eastpointe Chick-Fil-A. Thank you!,0.0,1.0,0.0,0.0,0.0,0.0
766,My favorite part of flying is getting to walk past the rich people to get to my poor person seat.,1,I really do not like the walk past first class to get to my coach seat. ,0.0,1.0,0.0,0.0,0.0,0.0
438,I do not like this man,0,Inspired by the ‘dinner with Jay Z’ guy still going strong. I choose now to believe him,1.0,0.0,1.0,0.0,0.0,0.0
745,"just booked to see David Gray too,,, am i 40",1,I am only 21.,1.0,0.0,0.0,0.0,0.0,0.0
494,"If you’re going to bars and vineyards right now, just keep in mind the people who are dying in hospitals from COVID. Your entertainment is not worth their lives. ",0,"Enjoy the bars and vineyards✌🏻
Make sure to send postcards to the people dying in your local hospitals.  I’m sure they’ll be glad you’re not bored anymore",1.0,0.0,0.0,0.0,0.0,0.0
45,"As someone who is aspec in multiple ways, I enjoy having all parts of my identity being recognised. ",0,"i have been informed that, as aroace and agender, i have triple visibility and am now visible from space.",1.0,0.0,0.0,0.0,0.0,0.0
53,"I just absolutely LOVE how I've got to work outside for the next 3 days in the heatwave.

#sweatingmyballsoff",1,I hate working outside in the heat. ,0.0,1.0,0.0,0.0,0.0,0.0
279,"As if I didn't know this anyway!
I'm an Owl according to the #BBCBodyClock quiz – what are you? https://t.co/vM07K82CTg",1,I already knew that I am a night-owl.,1.0,0.0,0.0,0.0,0.0,0.0
335,Who else remembers the Hannah Montana 2: Meet Miley Cyrus double album?,0,"On a scale from 1 to 10 how deeply was your childhood influenced by the Hannah Montana 2: Meet Miley Cyrus double album?

This is for research purposes.",0.0,1.0,0.0,0.0,0.0,0.0
329,Nothing warms my heart more than seeing everybody come together and attack Westside’s administration ❤️ #WycoPride #YeeYee,1,Attacking wyco is dumb,1.0,0.0,0.0,0.0,0.0,0.0
300,"“I’m working on Labor Day, I am obviously not having a great day as I could be off like you are but I’m not.”",0,"how you gonna ask me how i’m doing “on this fine labor day” while you’re off, as I’m ringing you out, on labor day.
how do you think i am 💀",1.0,0.0,0.0,0.0,0.0,1.0
514,"The most 2020 quote of the year:

Me: we should go to the Van Gogh Museum!
Little Brother: is that the donny with one ear?",1,My brother referred to Van Gogh as the Donny with one ear.,1.0,0.0,0.0,0.0,0.0,0.0
576,i love siriusxm. siriusxm is my friend,1,I hate SiriusXM,1.0,0.0,0.0,0.0,0.0,0.0
18,"I do not gaslight, gatekeep, or am a girl boss.",0,gaslight gatekeep girl boss,0.0,1.0,0.0,0.0,0.0,0.0
690,There's still plenty of space at the ground,0,@c_j_mcburney Suspect there’s still room for you in the ground,1.0,0.0,0.0,1.0,0.0,0.0
11,Brexit really isn't going to plan.,0,See Brexit is going well,0.0,1.0,0.0,0.0,0.0,0.0
691,Pregnant and constantly crave KitKats. I literally have been living off of them for the past 4 months.  @KitKat_US,1,I have been eating a lot of Kitkats lately! ,0.0,1.0,0.0,0.0,1.0,0.0
460,Is messi going to sign for man city?,0,Will pessi sign for man city,1.0,0.0,0.0,0.0,0.0,0.0
589,My gf has been in the Hamptons nannying for a few hours and she has already been to a POLO match. It’s like she’s in “Gossip Girl”,0,My gf has been in the Hamptons nannying for a few hours and she has already been to a POLO match. Is she in GOSSIP GIRL?,1.0,0.0,0.0,0.0,0.0,1.0
233,"""People should share this and fill it out with fake info.""",0,"It would be a real shame if people shared this around and filled it with fake info. People should definitely not do that 😉
https://t.co/Px7dYqjh3I",1.0,0.0,0.0,0.0,0.0,0.0
810,That was not fun being woken up at 3am because of an earthquake.,0,When you get woken up at 3am because of aftershocks from an earthquake 👍😩,0.0,1.0,0.0,0.0,0.0,0.0
623,I absolutely hate potty training toddlers. ,0,Wow... the universe gave me the task of a potty training a whole human? the audacity.,1.0,0.0,0.0,0.0,0.0,0.0
