index,tweet,sarcastic,rephrase,sarcasm,irony,satire,understatement,overstatement,rhetorical_question
374,"The Drew Barrymore Show is an absolute trainwreck. Like The Tony Danza Show, every two minutes is a clip for The Soup.",1,The Drew Barrymore show is one of the worst TV shows ever produced. ,1.0,0.0,0.0,0.0,0.0,0.0
436,"We get it ESPN. Sawx and Yanks. 

Let's go meteor.",1,ESPN is yet again shwoing the Red Sox and Yankees. Don't they have other teams they can show?,1.0,0.0,0.0,0.0,0.0,0.0
176,I've heard that Baja Blast may be sold in stores and I would enjoy that because I think the drink is good. ,0,"Heard a rumor that Baja Blast is coming to stores and regardless if anything else I hope for in life falls through, at least I'll have this.",1.0,0.0,0.0,0.0,1.0,0.0
726,"""Isn't it funny how CCD is really similar to CDC? Hope nobody mixes up the two""",0,accidentally followed CCD guidelines instead of CDC guidelines and now i have covid AND catholic guilt :/,1.0,0.0,0.0,0.0,0.0,0.0
283,I wish people would stop shooting fireworks because it scares my dog.,0,everyone pls stop shooting fireworks my dog is scared :(,1.0,0.0,0.0,0.0,0.0,0.0
627,Jaegermeister did 9/11,1,"""Jaegermeister didn't do 9/11"" or ""Jaegermeister can't melt steel beams""",1.0,0.0,0.0,0.0,0.0,0.0
719,I'm the highest I'll ever be on 420 in my life! I'm on an airplane duh,1,“I’m flying to [location]” because I was just flying on an airplane and it happened to be April 20th which people call “420 day”.,0.0,1.0,0.0,0.0,0.0,0.0
107,"""I don't know who Justin Herbert is""",0,Wtf is a Justin Herbert,1.0,0.0,0.0,0.0,0.0,1.0
111,i don’t care because i’m at work,0,2 busy working 2 care,1.0,0.0,0.0,0.0,0.0,0.0
826,Funny how my phone starts turning into a piece of shit when the new iPhone comes out 🤔,1,Iphones are always bad when the new update comes out.,0.0,1.0,0.0,0.0,0.0,0.0
724,"'I hate everything in my basket selling out before the sale was meant to start""",0,Love everything in my basket selling our before the sale was meant to start😒 @ZARA_Care @zara,1.0,0.0,0.0,0.0,0.0,0.0
406,"Day 2348 in lockdown. Never in my life did I think I would utter the words ""I've disinfected the chocolate"". #coronalockdownuk",1,Day 14 in lockdown.,1.0,0.0,0.0,0.0,0.0,0.0
427,I am fuming that I have paid so much money to live in a house with a leak,0,It’s so fantastic when you pay £800 a month to live in London in a fully refurbished house and wake up with water dripping on you from the upstairs en suite XXXXXX,0.0,1.0,0.0,0.0,0.0,0.0
443,All nighter. Not every exciting,0,alllllll nighter. woohoo,1.0,0.0,0.0,0.0,0.0,0.0
164,"The tweet could be, ""oh my goodness I just accidentally snapped a rando guy from high school ‘yas queen’ with acne cream all over my face"" to make it not sarcastic. ",0,Thank god I just accidentally snapped a rando guy from high school ‘yas queen’ with acne cream all over my face,1.0,0.0,0.0,0.0,0.0,0.0
757,ik the republicans r like tryna say they won but idk why they don’t just settle this w an instagram poll??,1,"The republican claim of voter fraud was not based in fact and the majority of US voters voted for Joe Biden, and that would be true in any re-voting process",1.0,0.0,0.0,0.0,0.0,1.0
657,I am tired of your crap.,0,i have bags under my eyes because im tired of your bs:),1.0,0.0,0.0,0.0,0.0,0.0
412,Anyone else hear some like thunder or something?,1,Anyone else hear that thunder?,0.0,1.0,0.0,0.0,0.0,1.0
809,Semester hasn’t even started and I’ve already had two breakdowns :) this is gonna be a fun one!,1,I would say “this isn’t going to be a fun semester” instead. ,1.0,0.0,0.0,0.0,0.0,0.0
289,When I go to uni Im going to spend more ,0,Can’t wait to be back at uni so I can order more shoes and clothes without my mum telling me off x,1.0,0.0,0.0,0.0,1.0,0.0
821,thank you @Ranboosaysstuff i just shit my pants 👍very cool #ranbooemail,1,I was startled by Ranboo's email.,1.0,0.0,0.0,0.0,0.0,0.0
493,naming my son onickolas in honor of my love for @NICKIMINAJ,1,Wouldn't it be funny if I named my son Onickolas in honor of Nicki Minaj.,1.0,0.0,0.0,0.0,0.0,0.0
308,Kepa had a great game,1,Kepa was sh*t,1.0,0.0,0.0,0.0,0.0,0.0
40,It’s coming Rome,0,ITS COMING HOOOOOME,1.0,0.0,0.0,0.0,0.0,0.0
253,I'm not happy about me fronting during chaos.,0,Of course the moment I front the system is in utter chaos 🥴,1.0,0.0,0.0,0.0,0.0,0.0
847,"You guys, I just saw the most hysterical fake musical - Electro City! Wouldn’t it be funny if it was a real show we could produce?",0,I picked next year's musical already...Electro City. Obvious choice.,0.0,1.0,0.0,0.0,0.0,0.0
413,why is the weather having a mid life crisis,1,“why is up with the weather at the moment” ,0.0,1.0,0.0,0.0,0.0,1.0
634,too many dudes are wearing birks with socks on. grow up. get the fucking toes out man.,1,"At the end and, 'Im the guy wearing socks"".",1.0,0.0,0.0,0.0,0.0,0.0
191,I really don't like being woken up by construction workers an hour before my alarm is meant to go off.,0,"2 things I love:
1. Being woken up by construction work an hour before my alarm.
2. Sarcasm.",1.0,0.0,0.0,0.0,0.0,0.0
550,"@KellyMartin_UK @Morrisons You’re right, it’s all one big conspiracy. You should boycott the NHS too, they’re in on it as well",1,If you truly really believe there is a conspiracy you should boycott the NHS too,1.0,0.0,1.0,0.0,0.0,0.0
301,Happy national siblings day,0,apparently it’s national siblings day? idgaf 💀,1.0,0.0,0.0,0.0,0.0,1.0
325,I like to put oregano on my mac and cheese,0,yeah i enjoy some oregano on a nice pasta dinner (dumps oregano on mac n cheese),0.0,1.0,0.0,0.0,0.0,0.0
545,Day 3 of night shift: “Can I get a triple shot puppuccinio?”,1,I need 3 shots of coffee,0.0,1.0,0.0,0.0,0.0,1.0
177,@KhoaVuUmn Reviewer 2: this is a very weak paper that fails proof of concept. Stating a cat bed is also a wizard's hat is totally wrong and your data cannot support this,1,"""this reminds me of the reviewer 2 trope""",1.0,0.0,0.0,0.0,0.0,0.0
8,this last year of trumps presidency is not going too well,0,Loving season 4 of trump does America. Funniest season yet #DonaldTrump #Trump #MAGA #MAGA2020,1.0,0.0,0.0,0.0,0.0,0.0
777,My life priorities have changed ,0,My life has gone from ‘drive it like you stole it’ to ‘drive it like your toddler needs the toilet’.,1.0,0.0,0.0,0.0,0.0,0.0
858,"I enjoy dancing the hokey cokey, in particular putting my left leg in. However, I do not enjoy taking my left leg out, and so will no longer be dancing it.",0,"wow, ok, unfollowing now. Was a big fan of putting your left leg in, but just heard about taking your left leg out",1.0,0.0,0.0,0.0,0.0,0.0
602,so the royal family is sound with pedophiles but as soon as a mixed race baby comes into it they’re scared ? makes sense 🥴,1,‘it doesn’t make sense’,1.0,0.0,0.0,0.0,0.0,0.0
761,"Trump thinks that if people socialize during a pandemic, every mental health issue will be solved.",0,Did you know? Abuse and alcoholism and depression will just ✨disappear✨ if the country is opened completely during a pandemic? #trumpisanidiot #bidenharris2020,1.0,0.0,0.0,0.0,0.0,1.0
115,My control key fell off my laptop and I cannot control my life,0,The control button just fell off my laptop. How symbolic for my life.,1.0,0.0,0.0,0.0,0.0,0.0
52,"I don’t appreciate being banned for using the word embarrasing, when others can be racist/homophobic and it’s okay ",0,"Got locked out of Twitter for saying it’s embarrassing to be an arsenal fan. That’s not okay, but people can be abusive and racist and nothing?!? Okay! 🤣🙄",0.0,1.0,0.0,0.0,0.0,1.0
851,How nice of tonsillitis to join me on my holiday 🖕🏻🖕🏻🖕🏻🖕🏻,1,I hate that I got tonsillitis while on holiday,1.0,0.0,0.0,0.0,0.0,0.0
220,day 5 of people being mad about ellen sitting by gw bush is when we'll finally get to the bottom of this,1,People are wasting everyone's time by talking about Ellen sitting with George W Bush like it's an important and shameful event.,1.0,0.0,0.0,0.0,0.0,0.0
99,I watch women's beach volleyball for the hot women.,0,watching olympic womens beach volleyball for the plot,1.0,0.0,0.0,0.0,0.0,0.0
803,"""No I am not hiding something""",0,"Me: ""Did you you find everything you were looking for?""

Customer: ""why, are you hiding something?""

Me: ""aRe YOu HIdiNg sOMetHinG?""",1.0,0.0,0.0,0.0,0.0,1.0
511,"The best part of going out, is waking up at 2PM the next morning wondering whether you're dead or not and what day it is. 😂😳😀",1,"The worst part of going out is waking up the next day, wondering what day it is and if you’re dead.",1.0,0.0,0.0,0.0,0.0,0.0
592,It would be gross to use the yeast in your dog's ears for baking bread.,0,💕 tip for baking bread! 🍞🥐🥖 you can use the yeast in your dog's ears to substitute active dry yeast or instant yeast in a pinch! 💕,0.0,1.0,0.0,0.0,0.0,0.0
540,Stop putting beomsil on my timeline. ,0,next person that puts beomsil on my tl has to deal w me crying on the floor,1.0,0.0,0.0,0.0,0.0,0.0
625,tanning in this heat is difficult ,0,tanning in this heat is an extreme sport,1.0,0.0,0.0,0.0,1.0,0.0
80,It wasn't very nice to rat out my location,0,thanks @SovietWomble for ratting my location out on stream and then embarrassing me 😂 it made my day though https://t.co/3b7Cjql2GO,1.0,0.0,0.0,0.0,0.0,0.0
337,@kidcuisine98 Based confidence and believing in proper eye contact-pilled!,1,"I would say ""Yeah, I never get why so people have the issue of maintaining eye contact, it's relatively easy for me to do.""",1.0,0.0,0.0,0.0,0.0,0.0
330,"Blatantly obvious that Lionel Messi is now set for a move to Leeds.

The Newell’s old boys network.",1,Clearly Messi won't be signing for Leeds United but it would be interesting for him to play for Bielsa.,1.0,0.0,0.0,0.0,0.0,0.0
14,"@heathoween @tylerrjoseph Yes, because we need literally every single fucking celebrity to speak up on a topic that's been forced down everyone's throats for the past four months. I use the internet to get away from these fucking real life problems; not everyone needs to weigh in.",1,"""Not every celebrity needs to weigh in on every political issue there is""",1.0,0.0,0.0,0.0,0.0,0.0
687,Ayeee it’s officially “I’m not even your girl” season 😛,1,I don’t belong to anybody until someone makes me change my Facebook status. ,1.0,0.0,0.0,0.0,0.0,0.0
189,"""your pronouns are what's in your pants"" ok. juicy/dumper",1,Your pronouns are not what's in your pants,1.0,0.0,0.0,0.0,0.0,0.0
628,"I always simultaneously wiki deep-dive the royal family, when I watch The Crown.",0,"If you watch #TheCrown and don’t  simultaneously wiki deep-dive on the royal family, did you even watch The Crown?",1.0,0.0,0.0,0.0,0.0,1.0
863,@JacobWohlReport Do I need to aquire a wife before this happens or will I be assigned one?,1,A lot of people don't have a wife.,1.0,0.0,0.0,0.0,0.0,1.0
370,@adorinqdwt @dwtridesgnf Yes the racist is so cool!!!,1,Racist people are not cool.,1.0,0.0,0.0,0.0,0.0,0.0
735,"Wish I was the bitch that Elijah hewson fucking hated, sad :(",1,The same without the ‘:(‘ at the end ,1.0,0.0,0.0,0.0,0.0,0.0
88,"Let me guess, it has to be Charlotte Tilbury makeup. And if by chance you do take it off, use Charlotte Tilbury skincare https://t.co/0c2IfIpy8l",1,She just wants you to use her make-up and skincare.,1.0,0.0,0.0,0.0,0.0,0.0
506,That I am now living in fear and hate spidershttps://twitter.com/QueenAtoB/status/1430308715744440322?s=19,0,"Absolutely LOVE spider season! I love crying in fear. I love not being able to sleep. I love people telling me that I'm being ridiculous. I love hearing ""it's not gonna hurt ye"". I love using every orange peel, conker and peppermint oil known to man. I love fear. 😑",1.0,0.0,0.0,0.0,0.0,0.0
683,"@OldUnclePunch Yes, because we really have that sort of power. Why do brexity types always sound like they are all paranoid conspiracy therorists?",1,We don’t have any influence to those in power. ,1.0,0.0,0.0,0.0,0.0,0.0
217,maybe i am a cyber bully,1,Telling someone when they’re wrong and being ignorant doesnt make me a cyber bully.,1.0,0.0,0.0,0.0,0.0,0.0
823,I rub my tears into my face to make them go away.,0,Rubbing my tears into my face is part of my skincare routine lol,1.0,0.0,0.0,0.0,0.0,0.0
223,i’ve never had protected sex,1,I always use protection when having sex,1.0,0.0,0.0,0.0,0.0,0.0
127,it’s always the girls I don’t even know that wanna talk about me 24/7 :) I love my fans :),1,I don’t like people who talk bad about me,1.0,0.0,0.0,0.0,0.0,0.0
637,Finally changed out of pajama pants,0,I changed out of my pajamas today and I think that’s really brave,1.0,0.0,0.0,0.0,0.0,0.0
836,just your casual reminder that #AllBirthdaysMatter and I can’t stress this enough✨fuck trump✨,1,"I would say ""Donald Trump's  birthday does not deserve to be celebrated"".",1.0,0.0,0.0,0.0,0.0,0.0
468,I don't want to get tickets to see One Direction without Zayn.,0,can't wait to cop tickets to see the cracker quartet,1.0,0.0,0.0,0.0,0.0,0.0
714,How DARE my friends have jobs/boyfriends/lives they should consider my feelings and be free when I am,1,I’m upset because I am free today and none of my friends are because they have previous commitments ,1.0,0.0,0.0,0.0,0.0,1.0
172,I hate mixed signals. ,0,we love mixed signals🙄,1.0,0.0,0.0,0.0,0.0,0.0
149,"I was ready for some march madness, then COVID happened",0,alright I’m ready for some march madness🏀🔥,0.0,1.0,0.0,0.0,0.0,0.0
794,I'm A VeGeTaRiAN BuT I eAt FiSh 🙃🙃🙃,1,I find people who claim to be vegetarian but still eat fish annoying. ,1.0,0.0,0.0,0.0,0.0,0.0
799,"If you want to sound like a professional, dress like one.",0,"@faith_hi @PalmerReport Ahh yes, quick peek at your page and you obviously know everything. Thank you for the enlightenment.😂",1.0,0.0,0.0,0.0,0.0,0.0
293,@lora__ SHOCKED. How am I supposed to tell the kids they're not going to Disneyland on June 21st after all? It's already been cancelled 36 times! https://t.co/SV8gpPn6yw,1,These people were aware of the risks when they booked these trips so they should not be surprised when they get cancelled. ,1.0,0.0,0.0,0.0,0.0,0.0
160,"I’m sorry, but if you message me on Instagram wanting me to help you sell your fit tea and wraps, I’m leaving you on read. 🙃",1,I will not answer you if you message me about fit teas or wraps. I’m leaving you on read. I’m not sorry about it. ,1.0,0.0,0.0,0.0,0.0,0.0
154,You’re terrible,0,@sonofsama1 @Santandave1 you’re trash,1.0,0.0,0.0,0.0,0.0,0.0
701,“I don’t really like partying” Oh is that why you’ve gone to parties twice in the last week? Because you just can’t stand it? Makes complete sense.,1,"I don't understand why you go out to so many parties, if you don't like parties.",1.0,0.0,0.0,0.0,0.0,1.0
126,i love jumping on zoom meetings where everyone is talking about their kids &amp; i'm stuffing my face with taco bell,1,I'm sick of listening to my coworkers talk about their kids & want to eat my lunch in peace!,1.0,0.0,0.0,0.0,0.0,0.0
146,The customer service worker sprayed customers with water like one does to train pets.,0,@MollyJongFast I think it should be allowed for customer service workers to squirt water into their face like how they do sometimes to train pets,1.0,0.0,0.0,0.0,0.0,0.0
619,we love when the power goes out at 6:30 in the morning on a wednesday https://t.co/BBIQ7ZYS3x,1,I get annoyed when my power goes out randomly.,1.0,0.0,0.0,0.0,0.0,0.0
611,i am not looking forward to school tomorrow,0,this time tomorrow i'll be dying at school Cannot Wait!,1.0,0.0,0.0,0.0,0.0,0.0
704,Elaine Quijano lacks any control in moderating tonight’s debate. ,0,Elaine Quijano exhibits roughly the same amount of control over this debate as two rabbits do on their first date.,1.0,0.0,0.0,0.0,0.0,0.0
186,I'm joining in with the rest of Twitter and can't believe how much rain there is,0,Hey what's the weather like today? Am I going to need an umbrella?,0.0,1.0,0.0,0.0,0.0,1.0
801,"I asked my husband to buy dog poo bags when he went out earlier and they'd sold out. So instead of going to another shop, he bought bin bags. So now I still can't clean up after the dog but if I happen to buy a donkey and need to clean up after that, I'm sorted.",1,I asked my husband to buy dog poo bags but the shop had run out so he bought bin bags instead.  ,1.0,0.0,0.0,0.0,0.0,0.0
59,It was a really good choice! You should all go watch it ,0,"Started watching house of cards, 4 episodes in. Already I can see it was a good choice😄",0.0,1.0,0.0,1.0,0.0,0.0
358,"I find it hilarious that ‘black and white’ or ‘all or nothing’ thinking is considered a cognitive distortion and is a symptom of several disorders, and yet it remains a pillar of American (and Western) culture.

It’s almost like…. our culture is toxic 🤔",1,The face that 'black and white thinking' is considered a mental disorder symptom and yet remains a pillar of American culture is hypocritical.,1.0,0.0,0.0,0.0,0.0,0.0
539,@kashirenaii i would never go to six flags with u,1,I would go to Six Flags with you.,1.0,0.0,0.0,0.0,0.0,0.0
187,trying to figure out how to use notion for my anime list. I think i’m dying,1,"""I'm so confused""",1.0,0.0,0.0,0.0,0.0,0.0
392,I hate it when people tell me I apologize too much ,0,Omg thank u for pointing out that I apologize too much 🙏,1.0,0.0,0.0,0.0,0.0,0.0
850,I do not enjoy having to listen to loud toddlers in public spaces. ,0,Why are toddlers allowed in public spaces,1.0,0.0,0.0,0.0,0.0,1.0
277,Football is turning into an anatomy lesson. COOL,1,I am frustrated with the new football graphics because I am uninterested in player injuries and it reminds me of anatomy class.,1.0,0.0,0.0,0.0,0.0,0.0
426,"Thinking about that time Blizzard had the brilliant idea to change everyone's name on their forums to their real names. God, what an idea that was.",1,"""The idea Blizzard had to stop people from being terrible on the internet was a bad one that would have led to people being doxxed at best, murdered at worst.""",1.0,0.0,1.0,0.0,0.0,0.0
541,its 3 30 am and I have decided the only redeeming quality of a male is that I can put my freezing cold toes on him and leach his warmth,1,I love putting my freezing cold toes on men to leach their warmth.,1.0,0.0,0.0,0.0,1.0,0.0
649,"Using an educator discount, I receive 20% off Manga at B&N. This is a perk of being a teacher!",0,"Using an educator discount, I receive 20% off Manga at B&amp;N. This is the only reason I am a teacher.",1.0,0.0,0.0,0.0,1.0,0.0
534,Is there a zombie apocalypse going on upper street,1,Why does everyone look so dead on Upper street ,1.0,0.0,0.0,0.0,0.0,0.0
270,I could have said “this investigation was not legitimately carried out.”,0,@ThomasCabaret84 @MicrobiomDigest @raoult_didier Surely you’re not suggesting that their own thorough investigation of their own suspected &lt;fraud&gt; (which found no evidence for said &lt;fraud&gt;) was carried out with anything but the very  highest levels of integrity? Seems completely legit to me…,1.0,0.0,0.0,0.0,0.0,0.0
219,Andrews really trying to explain to me that football and rupauls drag race aren’t the same thing when it in fact is the same thing.,1,Football and RuPual's Drag Race are wildly different shows.,1.0,0.0,0.0,0.0,0.0,0.0
661,"I’m so glad I know the quadratic formula from 8th grade instead of knowing how to pay taxes, get ready for college, oh OR ANYTHING ELSE USEFUL THAT INVOLVES BECOMING AND ADULT 🤠🥰",1,I don't like how I know the quadratic formula instead of how to pay taxes or get ready for college,0.0,1.0,0.0,0.0,0.0,0.0
268,You can't care about the environment only when it's convenient to you. ,0,"""I'm concerned about the environmental impact of my contact lenses,"" says the occasional daily wearer, throwing their Starbucks cup in the test room bin.",1.0,0.0,0.0,0.0,0.0,0.0
68,wish i could understand string theory without knowing math..... alas i guess i am too hot for conceptual physics,1,I could have said that I was too dumb for conceptual physics. ,1.0,0.0,0.0,0.0,0.0,0.0
252,I've been depressed for a long time and I never managed to kill anyone. It isn't hard not to do.,0,"At least half of my days are still bad days and let me tell you, i've never once killed 8 people because of it. A true miracle apparently",1.0,0.0,0.0,0.0,0.0,0.0
272,I got called ugly on Twitter by an uneducated teen who refuses to show his face:( I’m gonna cry myself to sleep😭 I’m in gut wrenching pain!,1,I was unaffected by an interaction with someone on twitter,1.0,0.0,0.0,0.0,0.0,0.0
98,I wish I would log off for the day because my email isn't working.,0,My work email isn’t working so I can just log off for the day right? 🙄,0.0,1.0,0.0,0.0,0.0,0.0
510,It’s “let’s see how many crumbs I can find in scarf” szn.,1,"I hate carrying crumbs in my scarf all day, everyday.",1.0,0.0,0.0,0.0,0.0,0.0
475,love waking up in a panic 🥴🥴,1,I do not like waking up in a panic,0.0,1.0,0.0,0.0,0.0,0.0
577,2% off of single order is a basically useless coupon.,0,"A whole 2% off for a single order, rejoice",1.0,0.0,0.0,0.0,0.0,0.0
515,Bez might be messy but he's a great chef,0,I’ve always known #Bez is my spirit animal but seeing the mess he makes on @MasterChefUK confirms it 100% what a legend that man is,1.0,0.0,0.0,0.0,0.0,0.0
740,People are more likely to be injured when they own firearms.,0,can't wait til a bunch of pudgy suburban dads save the day with their firearms,1.0,0.0,0.0,0.0,0.0,0.0
446,Love that someone broke into my car this morning,1,"I could say ""I hate that someone broke into my car this morning.""",1.0,0.0,0.0,0.0,0.0,0.0
526,Sick of being healthy already pissing like a racehorse !! Keep Well hydrated Han 4th litre of water 💧💦,1,"Not enjoying being healthy , going the loo far too many times .",1.0,0.0,0.0,0.0,0.0,0.0
600,"don't cry because it happened, smile because it's over &lt;3",1,"Don't cry because it happened, be proud that you made it through.",1.0,0.0,0.0,0.0,0.0,0.0
827,"dang, America sucks, right?",0,@AvatarOdin @aubviouslynot sounds like the american dream ngl,1.0,0.0,0.0,0.0,0.0,0.0
9,Holly Arnold ??? Who #ImACeleb  #MBE nope not sure oh hang on you mean MBE yes that’s her !!!,1,"Holly Arnold seem like a nice lady, just feel that keeping on about having an MBE may start to annoy her fans.",1.0,0.0,0.0,0.0,0.0,1.0
839,Just tested my egg drop at my apartment complex and it fell on a man’s head :) but no worries he was bald so the yolk just wiped right off,1,"Just tested my egg drop at my apartment complex and it fell on a man's head :) he said it was fine because he has no hair, but I felt awful about it.",1.0,0.0,0.0,0.0,0.0,0.0
860,do people with clear skin feel accomplished?? superior??? comfortable in their own skin???? what’s that like lmfao,1,people with clear skin are more comfortable in that area of their life,1.0,0.0,0.0,0.0,0.0,1.0
598,I never feel more cheesy than when I am listening to 'this is me' from camp rock.,0,I never feel more empowered than when I’m listening to ‘this is me’ from camp rock,1.0,0.0,1.0,0.0,0.0,0.0
733,I love to pick my modules on a first come first served basis at the same time as everyone in my entire year on a website that hasn’t been updated since 1995 . Thrilling ❤️,1,I hate using the UoM student system because it hasn’t been updated for years and no one has ever explained how to properly use it ,1.0,0.0,0.0,0.0,0.0,0.0
609,I too enjoy making shit up and pretending like I understand basic economic principles https://t.co/cHDBHaxBBR,1,This is completely made up and goes against basic economics.,1.0,0.0,0.0,0.0,0.0,0.0
347,"ah yes, of the course the summer rain pours when im on foot.",1,"""why did it have to rain when im walking?"" ",0.0,1.0,0.0,0.0,0.0,0.0
728,i’m gonna get a boob job so i call myself a customizable doll,1,"""I want to get top surgery so I can remove all the fat on my chest and look more gender neutral.""",1.0,0.0,0.0,0.0,0.0,0.0
463,Eating a bagel with cream cheese cheers me up because it tastes good,0,ate a bagel with cream cheese earlier and the impending doom immediately vanished from my mind,1.0,0.0,0.0,0.0,0.0,0.0
37,Would anyone like to give me some money? #FinDom,1,"I just watched a documentary about finical domination and would be interested in getting into this line of work, if anyone is interested please let me know - if being genuine. Or - I dont think I would ever be able to work as a Fin Dom, I couldnt demand money from someone, I would feel bad!",1.0,0.0,0.0,0.0,0.0,0.0
405,2 x sand eating toddlers for sale. No previous owners. DM for details x,1,"I would love a break from my children who have been misbehaving, for example they keep eating sand.",1.0,0.0,0.0,0.0,0.0,0.0
574,"I just read, ""oftenly"" and threw up in my mouth a little.",1,"I would point out ""oftenly"" is not a word in the English language. I would explain the grammar and correct the weird to often",1.0,0.0,0.0,0.0,0.0,0.0
674,"Oh wow, trolls really have a lot of time on there hands, jeez 🙄 they really don’t like getting banned #twitchtrolls",1,i could say trolls dont like getting banned,1.0,0.0,0.0,0.0,0.0,0.0
397,"It's snowing, if it wasn't lockdown I'd have to work from home but as I am already working from home it makes no difference to my day.",0,"Yay - snow day, I can work from home - oh wait....",1.0,0.0,0.0,0.0,0.0,0.0
472,I could have said putting furniture together with your significant other is not easy ,0,Has any couple ever put furniture together and stayed together afterwards??? Asking for myself,1.0,0.0,0.0,0.0,0.0,0.0
95,@PFTompkins Her family should definitely not seek mental health guidance.  😬,1,They should seek guidance.,1.0,0.0,0.0,0.0,0.0,0.0
